{
  "season": "2026-27",
  "data_version": 26,
  "updated_at_utc": "2026-10-18T21:41:57Z",
  "gw_list": [
    {
      "gw": 1,
      "status": "sealed",
      "manager": null,
      "manager_avatar": null,
      "score": 58,
      "total_points": 58,
      "overall_rank": 2201654,
      "gw_rank": 2201657,
      "chips": [],
      "transfers_count": 0,
      "transfers_cost": 0,
      "has_detail": true
    },
    {
      "gw": 2,
      "status": "sealed",
      "manager": null,
      "manager_avatar": null,
      "score": 66,
      "total_points": 124,
      "overall_rank": 5438692,
      "gw_rank": 7731394,
      "chips": [],
      "transfers_count": 0,
      "transfers_cost": 0,
      "has_detail": true
    },
    {
      "gw": 3,
      "status": "sealed",
      "manager": "Fran",
      "manager_avatar": "assets/avatar/Fran.jpg",
      "score": 51,
      "total_points": 175,
      "overall_rank": 5492162,
      "gw_rank": 5471861,
      "chips": [],
      "transfers_count": 1,
      "transfers_cost": 0,
      "has_detail": true
    },
    {
      "gw": 4,
      "status": "sealed",
      "manager": "Fran",
      "manager_avatar": "assets/avatar/Fran.jpg",
      "score": 89,
      "total_points": 264,
      "overall_rank": 3324502,
      "gw_rank": 940436,
      "chips": [],
      "transfers_count": 0,
      "transfers_cost": 0,
      "has_detail": true
    },
    {
      "gw": 5,
      "status": "sealed",
      "manager": "Fran",
      "manager_avatar": "assets/avatar/Fran.jpg",
      "score": 48,
      "total_points": 312,
      "overall_rank": 3343096,
      "gw_rank": 5099293,
      "chips": [],
      "transfers_count": 0,
      "transfers_cost": 0,
      "has_detail": true
    },
    {
      "gw": 6,
      "status": "sealed",
      "manager": "Fran",
      "manager_avatar": "assets/avatar/Fran.jpg",
      "score": 80,
      "total_points": 392,
      "overall_rank": 2046854,
      "gw_rank": 608004,
      "chips": [],
      "transfers_count": 0,
      "transfers_cost": 0,
      "has_detail": true
    },
    {
      "gw": 7,
      "status": "live",
      "manager": "remember",
      "manager_avatar": "assets/avatar/remember.jpg",
      "score": 36,
      "total_points": 428,
      "overall_rank": 3651060,
      "gw_rank": 9771179,
      "chips": [],
      "transfers_count": 0,
      "transfers_cost": 0,
      "has_detail": true
    },
    {
      "gw": 8,
      "status": "upcoming",
      "manager": "remember",
      "manager_avatar": "assets/avatar/remember.jpg",
      "score": null,
      "total_points": null,
      "overall_rank": null,
      "gw_rank": null,
      "chips": null,
      "transfers_count": 0,
      "transfers_cost": 0,
      "has_detail": false
    },
    {
      "gw": 9,
      "status": "upcoming",
      "manager": "remember",
      "manager_avatar": "assets/avatar/remember.jpg",
      "score": null,
      "total_points": null,
      "overall_rank": null,
      "gw_rank": null,
      "chips": null,
      "transfers_count": 0,
      "transfers_cost": 0,
      "has_detail": false
    },
    {
      "gw": 10,
      "status": "upcoming",
      "manager": "remember",
      "manager_avatar": "assets/avatar/remember.jpg",
      "score": null,
      "total_points": null,
      "overall_rank": null,
      "gw_rank": null,
      "chips": null,
      "transfers_count": 0,
      "transfers_cost": 0,
      "has_detail": false
    },
    {
      "gw": 11,
      "status": "upcoming",
      "manager": "欧巡",
      "manager_avatar": "assets/avatar/ocean.jpg",
      "score": null,
      "total_points": null,
      "overall_rank": null,
      "gw_rank": null,
      "chips": null,
      "transfers_count": 0,
      "transfers_cost": 0,
      "has_detail": false
    },
    {
      "gw": 12,
      "status": "upcoming",
      "manager": "欧巡",
      "manager_avatar": "assets/avatar/ocean.jpg",
      "score": null,
      "total_points": null,
      "overall_rank": null,
      "gw_rank": null,
      "chips": null,
      "transfers_count": 0,
      "transfers_cost": 0,
      "has_detail": false
    },
    {
      "gw": 13,
      "status": "upcoming",
      "manager": "欧巡",
      "manager_avatar": "assets/avatar/ocean.jpg",
      "score": null,
      "total_points": null,
      "overall_rank": null,
      "gw_rank": null,
      "chips": null,
      "transfers_count": 0,
      "transfers_cost": 0,
      "has_detail": false
    },
    {
      "gw": 14,
      "status": "upcoming",
      "manager": "欧巡",
      "manager_avatar": "assets/avatar/ocean.jpg",
      "score": null,
      "total_points": null,
      "overall_rank": null,
      "gw_rank": null,
      "chips": null,
      "transfers_count": 0,
      "transfers_cost": 0,
      "has_detail": false
    },
    {
      "gw": 15,
      "status": "upcoming",
      "manager": "中国合伙人",
      "manager_avatar": "assets/avatar/gsg.jpg",
      "score": null,
      "total_points": null,
      "overall_rank": null,
      "gw_rank": null,
      "chips": null,
      "transfers_count": 0,
      "transfers_cost": 0,
      "has_detail": false
    },
    {
      "gw": 16,
      "status": "upcoming",
      "manager": "中国合伙人",
      "manager_avatar": "assets/avatar/gsg.jpg",
      "score": null,
      "total_points": null,
      "overall_rank": null,
      "gw_rank": null,
      "chips": null,
      "transfers_count": 0,
      "transfers_cost": 0,
      "has_detail": false
    },
    {
      "gw": 17,
      "status": "upcoming",
      "manager": "中国合伙人",
      "manager_avatar": "assets/avatar/gsg.jpg",
      "score": null,
      "total_points": null,
      "overall_rank": null,
      "gw_rank": null,
      "chips": null,
      "transfers_count": 0,
      "transfers_cost": 0,
      "has_detail": false
    },
    {
      "gw": 18,
      "status": "upcoming",
      "manager": "中国合伙人",
      "manager_avatar": "assets/avatar/gsg.jpg",
      "score": null,
      "total_points": null,
      "overall_rank": null,
      "gw_rank": null,
      "chips": null,
      "transfers_count": 0,
      "transfers_cost": 0,
      "has_detail": false
    },
    {
      "gw": 19,
      "status": "upcoming",
      "manager": "进藤光",
      "manager_avatar": "assets/avatar/jtg.jpg",
      "score": null,
      "total_points": null,
      "overall_rank": null,
      "gw_rank": null,
      "chips": null,
      "transfers_count": 0,
      "transfers_cost": 0,
      "has_detail": false
    },
    {
      "gw": 20,
      "status": "upcoming",
      "manager": "进藤光",
      "manager_avatar": "assets/avatar/jtg.jpg",
      "score": null,
      "total_points": null,
      "overall_rank": null,
      "gw_rank": null,
      "chips": null,
      "transfers_count": 0,
      "transfers_cost": 0,
      "has_detail": false
    },
    {
      "gw": 21,
      "status": "upcoming",
      "manager": "进藤光",
      "manager_avatar": "assets/avatar/jtg.jpg",
      "score": null,
      "total_points": null,
      "overall_rank": null,
      "gw_rank": null,
      "chips": null,
      "transfers_count": 0,
      "transfers_cost": 0,
      "has_detail": false
    },
    {
      "gw": 22,
      "status": "upcoming",
      "manager": "进藤光",
      "manager_avatar": "assets/avatar/jtg.jpg",
      "score": null,
      "total_points": null,
      "overall_rank": null,
      "gw_rank": null,
      "chips": null,
      "transfers_count": 0,
      "transfers_cost": 0,
      "has_detail": false
    },
    {
      "gw": 23,
      "status": "upcoming",
      "manager": "香克利",
      "manager_avatar": "assets/avatar/shankly.jpg",
      "score": null,
      "total_points": null,
      "overall_rank": null,
      "gw_rank": null,
      "chips": null,
      "transfers_count": 0,
      "transfers_cost": 0,
      "has_detail": false
    },
    {
      "gw": 24,
      "status": "upcoming",
      "manager": "香克利",
      "manager_avatar": "assets/avatar/shankly.jpg",
      "score": null,
      "total_points": null,
      "overall_rank": null,
      "gw_rank": null,
      "chips": null,
      "transfers_count": 0,
      "transfers_cost": 0,
      "has_detail": false
    },
    {
      "gw": 25,
      "status": "upcoming",
      "manager": "香克利",
      "manager_avatar": "assets/avatar/shankly.jpg",
      "score": null,
      "total_points": null,
      "overall_rank": null,
      "gw_rank": null,
      "chips": null,
      "transfers_count": 0,
      "transfers_cost": 0,
      "has_detail": false
    },
    {
      "gw": 26,
      "status": "upcoming",
      "manager": "香克利",
      "manager_avatar": "assets/avatar/shankly.jpg",
      "score": null,
      "total_points": null,
      "overall_rank": null,
      "gw_rank": null,
      "chips": null,
      "transfers_count": 0,
      "transfers_cost": 0,
      "has_detail": false
    },
    {
      "gw": 27,
      "status": "upcoming",
      "manager": "紫葱酱",
      "manager_avatar": "assets/avatar/zcj.jpg",
      "score": null,
      "total_points": null,
      "overall_rank": null,
      "gw_rank": null,
      "chips": null,
      "transfers_count": 0,
      "transfers_cost": 0,
      "has_detail": false
    },
    {
      "gw": 28,
      "status": "upcoming",
      "manager": "紫葱酱",
      "manager_avatar": "assets/avatar/zcj.jpg",
      "score": null,
      "total_points": null,
      "overall_rank": null,
      "gw_rank": null,
      "chips": null,
      "transfers_count": 0,
      "transfers_cost": 0,
      "has_detail": false
    },
    {
      "gw": 29,
      "status": "upcoming",
      "manager": "紫葱酱",
      "manager_avatar": "assets/avatar/zcj.jpg",
      "score": null,
      "total_points": null,
      "overall_rank": null,
      "gw_rank": null,
      "chips": null,
      "transfers_count": 0,
      "transfers_cost": 0,
      "has_detail": false
    },
    {
      "gw": 30,
      "status": "upcoming",
      "manager": "紫葱酱",
      "manager_avatar": "assets/avatar/zcj.jpg",
      "score": null,
      "total_points": null,
      "overall_rank": null,
      "gw_rank": null,
      "chips": null,